{
    "Admiral": "Javelin",
    "AdmiralLevel": 3,
    "Class": "Achilles",
    "Type": "Heavy Cruiser",
    "AdmiralPoints": 65,
    "ShipPoints": 142,
    "Points": 207,
    "Tonnage": "M",
    "BaseSize": 40,
    "Profile": {
        "Thrust": 7,
        "Scan": 8,
        "Sig": 6,
        "Hull": 13,
        "ES": "3+",
        "KS": "4+",
        "BS": "6+",
        "G": "1",
        "Special": [
            "Regenerate-2",
            "Reinforced Armour"
        ]
    },
    "Weapons": [
        {
            "Name": "Heavy Calibre Broadside",
            "Arc": "B",
            "Att": 1,
            "Lock": "3+",
            "DMG": 3,
            "Type": "K",
            "Special": [
                "Calibre-H",
                "Penetrator",
                "Volley-2"
            ]
        },
        {
            "Name": "Heavy Calibre Broadside",
            "Arc": "B",
            "Att": 1,
            "Lock": "3+",
            "DMG": 3,
            "Type": "K",
            "Special": [
                "Calibre-H",
                "Penetrator",
                "Volley-2"
            ]
        }
    ],
    "Load": [
        {
            "Load": "Torpedo",
            "Launch": 1,
            "Special": [
                "Limited-1"
            ]
        }
    ],
    "Rules": [
        {
            "Name": "Self Repairing Armour Systems",
            "Text": "This Flagship cannot have its Energy Save reduced below a 5+."
        }
    ],
    "FleetAdmiralAbilities": 1,
    "AdmiralAbilities": [
        {
            "Cost": "2AP",
            "Name": "Heavy Sniper",
            "Effect": "When you assign targets to a weapon with the Calibre-H special rule, the attacking Ship doubles its Scan value against H Tonnage Ships for that weapon's attack (other attacks and weapons are unaffected)."
        }
    ],
    "Flavour": "Director Javelin is a man of few words, and seemingly fewer actions. Every fleet movement, every communication, always short and to the point. He is not a man to mince words or waste effort on the superfluous. The UCM believe that Javelin is more machine than man, that his cold calculating persona is a complete lack of humanity.\nThe truth is that Javelin is rather lacking in many of the extra augmentations PHR admirals get to further interface with their ships. Making him more human than his peers. His cold stoicism comes from his natural temperament when dealing with the unknown, and his caution comes from the knowledge his high-level clearance burdens him with.\nHe values PHR life incredibly highly and will defend them with singular efficiency, even going so far as to force the hand of his superiors to allow prototype self-repairing armour systems to be installed on-board his flagship. Thanks to the extra durability this provides his flagship, Javelin is able to plant his feet, so to speak, on critical locations."
}