{
    "Admiral": "Agency",
    "AdmiralLevel": 3,
    "Class": "Bastion",
    "Type": "Battleship",
    "AdmiralPoints": 65,
    "ShipPoints": 245,
    "Points": 310,
    "Tonnage": "H",
    "BaseSize": 50,
    "Profile": {
        "Thrust": 8,
        "Scan": 12,
        "Sig": 6,
        "Hull": 17,
        "ES": "3+",
        "KS": "3+",
        "BS": "4+",
        "G": "1",
        "Special": [
            "Porter L-1"
        ]
    },
    "Weapons": [
        {
            "Name": "Gravitic Hyperspear",
            "Arc": "FN",
            "Att": 6,
            "Lock": "3+",
            "DMG": 2,
            "Type": "C",
            "Special": [
                "Arrest-4",
                "Bloom-2"
            ]
        },
        {
            "Name": "Thermator",
            "Arc": "F",
            "Att": 3,
            "Lock": "4+",
            "DMG": 2,
            "Type": "E",
            "Special": [
                "Overcharge",
                "Scald-1"
            ]
        }
    ],
    "Load": [
        {
            "Load": "Torpedo",
            "Launch": 2,
            "Special": [
                "Limited-4"
            ]
        }
    ],
    "FleetAdmiralAbilities": 1,
    "AdmiralAbilities": [
        {
            "Cost": "2AP",
            "Name": "Sinthetic Grav Waves",
            "Effect": "When you inflict damage to an enemy Ship with a weapon with the Arrest-X special rule, each Ship in the damaged Group is affected by the Arrest rule and increases its X value by 2 for that attack."
        }
    ],
    "Flavour": ""
}