{
    "Admiral": "Gaius Chau",
    "AdmiralLevel": 5,
    "Class": "Romulus",
    "Type": "Dreadnought",
    "AdmiralPoints": 105,
    "ShipPoints": 450,
    "Points": 555,
    "Tonnage": "C",
    "BaseSize": 60,
    "Profile": {
        "Thrust": 6,
        "Scan": 12,
        "Sig": 14,
        "Hull": 25,
        "ES": "2+",
        "KS": "3+",
        "BS": "5+",
        "G": "1",
        "Special": [
            "Reinforced Armour"
        ]
    },
    "Weapons": [
        {
            "Name": "Hypernova Laser",
            "Arc": "FN",
            "Att": 3,
            "Lock": "3+",
            "DMG": 3,
            "Type": "C",
            "Special": [
                "Critical-1",
                "Focused"
            ]
        },
        {
            "Name": "Energy Glaive Battery",
            "Arc": "B",
            "Att": 6,
            "Lock": "3+",
            "DMG": 2,
            "Type": "E",
            "Special": [
                "Overcharge",
                "Volley-2"
            ]
        },
        {
            "Name": "Energy Glaive Battery",
            "Arc": "B",
            "Att": 6,
            "Lock": "3+",
            "DMG": 2,
            "Type": "E",
            "Special": [
                "Overcharge",
                "Volley-2"
            ]
        },
        {
            "Name": "Energy Glaive Battery",
            "Arc": "B",
            "Att": 6,
            "Lock": "3+",
            "DMG": 2,
            "Type": "E",
            "Special": [
                "Overcharge",
                "Volley-2"
            ]
        }
    ],
    "Load": [],
    "Rules": [
        {
            "Name": "Cutting Power",
            "Text": "If you attack with and do not Overcharge any of this Flagship's Energy Glaive Batteries, they gain Reave-2 for their attacks this activation."
        }
    ],
    "FleetAdmiralAbilities": 2,
    "AdmiralAbilities": [
        {
            "Cost": "2AP",
            "Name": "Backup Systems Engaged",
            "Effect": "When a friendly ship would roll for Crippling Damage, roll a dice. On a 4+ that Ship does not roll on the Crippling Damage table but is still Crippled."
        }
    ],
    "Flavour": ""
}