{
    "Admiral": "Ascendant",
    "AdmiralLevel": 4,
    "Class": "Zenith",
    "Type": "Dreadnought",
    "AdmiralPoints": 85,
    "ShipPoints": 520,
    "Points": 605,
    "Tonnage": "C",
    "BaseSize": 60,
    "Profile": {
        "Thrust": 6,
        "Scan": 14,
        "Sig": 10,
        "Hull": 22,
        "ES": "3+",
        "KS": "3+",
        "BS": "5+",
        "G": "1",
        "Special": [
            "Marines-3",
            "Reinforced Armour"
        ]
    },
    "Weapons": [
        {
            "Name": "Giga Lightvice",
            "Arc": "F",
            "Att": 8,
            "Lock": "2+",
            "DMG": 3,
            "Type": "K",
            "Special": [
                "Bloom-1",
                "Close Action",
                "Focused",
                "Scald-2"
            ],
            "Rule": "When determining potential targets for this weapon, you may use an unmodifiable Scan of 7\" instead of this Ship's Scan value."
        },
        {
            "Name": "Grand Bisector",
            "Arc": "FN",
            "Att": 5,
            "Lock": "3+",
            "DMG": 3,
            "Type": "E",
            "Special": [
                "Bloom-2",
                "Calibre-H/C",
                "Crippling",
                "Focused",
                "Penetrator"
            ]
        },
        {
            "Name": "Scythes",
            "Arc": "FN",
            "Att": 8,
            "Lock": "4+",
            "DMG": 1,
            "Type": "E",
            "Special": [
                "Anti Wing",
                "Fusillade-3",
                "Reave-1"
            ]
        },
        {
            "Name": "Scythes",
            "Arc": "FN",
            "Att": 8,
            "Lock": "4+",
            "DMG": 1,
            "Type": "E",
            "Special": [
                "Anti Wing",
                "Fusillade-3",
                "Reave-1"
            ]
        }
    ],
    "Load": [
        {
            "Load": "Fighters & Bombers",
            "Launch": 5,
            "Special": []
        },
        {
            "Load": "Boarding Pods",
            "Launch": 3,
            "Special": []
        }
    ],
    "Rules": [
        {
            "Name": "High Velocity Boarding Pods",
            "Text": "This Ship's Boarding Pods may be used against targets up to 6\" away."
        }
    ],
    "FleetAdmiralAbilities": 2,
    "AdmiralAbilities": [
        {
            "Cost": "2AP",
            "Name": "Overwatch",
            "Effect": "When you activate this Ship on General Quarters, you may choose to forgo attacking with this Ship. If you do, this Ship goes on Overwatch until the end of the round or until it declares the use of Overwatch. At the end of any enemy Group's activation, if that Group moved through this Ship's Front arc and was in weapons range while doing so, you may declare the use of Overwatch against that Group. When you use Overwatch, this Ship immediately makes an Attack as if on General Quarters against the enemy Group, even if it is out of arc and weapon range."
        }
    ],
    "Flavour": ""
}